{"format": "wl3pc.content-pack", "format_version": 2, "id": "approximations", "title": "Labelled approximations", "origin": "synthetic", "license": "test fixture", "movement": "movement.json", "rooms": ["rooms/r.json"], "start": {"room": "r", "x_px": 16, "y_px": 16}, "approximations": [{"subject": "room/r/legend/B", "behaves_as": "solid", "original": "breakable block", "task": "WL3-026"}, {"subject": "start", "behaves_as": "fixed corner start", "original": "spawn marker search"}]}
